{
  "$schema": "../schema/builtin-registry.schema.json",
  "schemaVersion": 1,
  "application": {
    "name": "MakerSpell",
    "version": "1.0.14+28",
    "sourceRepository": "https://github.com/mr-aydemir/MakerSync",
    "registrySource": "makersync_app/lib/services/printer_transport_registry.dart",
    "generatedBy": "makersync_app/tool/export_builtin_printer_references.dart"
  },
  "notice": "This is a review snapshot of compiled-in adapters. Community JSON profiles are activated only after schema validation and catalog approval; this file does not execute remote code.",
  "adapters": [
    {
      "order": 0,
      "id": "anycubic_lan",
      "displayName": "Anycubic LAN",
      "supportLevel": "experimental",
      "sourceFile": "makersync_app/lib/services/transports/anycubic_lan_transport.dart",
      "connection": {
        "serviceTypes": [
          "_anycubic-lan._tcp.local"
        ],
        "defaultPorts": [
          18910,
          18088
        ],
        "protocols": [
          "MQTT",
          "HTTP"
        ],
        "authentication": "pairing",
        "probeSummary": "Signed Anycubic LAN info query and advertised upload URL."
      },
      "capabilities": {
        "baseline": [
          "materials",
          "multiMaterial",
          "status"
        ],
        "supportedFileTypes": [
          "gcode"
        ],
        "conditional": [
          "upload, startPrint and camera require their experimental feature gates"
        ]
      },
      "contracts": [
        "jobControl",
        "deviceControl"
      ],
      "ui": {
        "sections": [
          "status",
          "activeJobControls",
          "deviceControls",
          "filaments"
        ],
        "jobControls": [
          "pause",
          "resume",
          "cancel"
        ],
        "deviceControls": [
          "nozzleTemperature",
          "bedTemperature",
          "partFan",
          "light",
          "speed"
        ],
        "printOptions": {
          "filamentMappingMode": "unsupported",
          "calibrationMode": "unsupported",
          "autoLevelingMode": "unsupported",
          "supportsFlowCalibration": false,
          "supportsTimelapseCapture": false,
          "resolvedFromFirmware": false
        }
      }
    },
    {
      "order": 1,
      "id": "bambu_lan",
      "displayName": "Bambu Lab LAN",
      "supportLevel": "protocolCompatible",
      "sourceFile": "makersync_app/lib/services/transports/bambu_lan_transport.dart",
      "connection": {
        "serviceTypes": [
          "_bambu-lan._tcp.local"
        ],
        "defaultPorts": [
          8883
        ],
        "protocols": [
          "MQTTS",
          "FTPS"
        ],
        "authentication": "accessCode",
        "probeSummary": "Authenticated Bambu LAN MQTT handshake."
      },
      "capabilities": {
        "baseline": [
          "camera",
          "materials",
          "multiMaterial",
          "startPrint",
          "status",
          "upload"
        ],
        "supportedFileTypes": [
          "gcode"
        ],
        "conditional": [
          "upload, startPrint, camera and native calibration require Developer Mode"
        ]
      },
      "contracts": [
        "printPreparation",
        "dynamicPrintPreparation",
        "jobControl",
        "deviceControl"
      ],
      "ui": {
        "sections": [
          "status",
          "activeJobControls",
          "deviceControls",
          "camera",
          "filaments"
        ],
        "jobControls": [
          "pause",
          "resume",
          "cancel"
        ],
        "deviceControls": [
          "nozzleTemperature",
          "bedTemperature",
          "partFan",
          "light",
          "speed"
        ],
        "printOptions": {
          "filamentMappingMode": "unsupported",
          "calibrationMode": "bambuNative",
          "autoLevelingMode": "unsupported",
          "supportsFlowCalibration": false,
          "supportsTimelapseCapture": false,
          "resolvedFromFirmware": true,
          "dynamicCandidates": [
            "calibration",
            "autoLeveling",
            "flowCalibration",
            "timelapseCapture"
          ]
        }
      }
    },
    {
      "order": 2,
      "id": "creality_local",
      "displayName": "Creality Local",
      "supportLevel": "verified",
      "sourceFile": "makersync_app/lib/services/transports/creality_transport.dart",
      "connection": {
        "serviceTypes": [
          "_creality._tcp.local",
          "_cxswbox._tcp.local"
        ],
        "defaultPorts": [
          80,
          9999
        ],
        "protocols": [
          "HTTP",
          "WebSocket"
        ],
        "authentication": "none",
        "probeSummary": "Creality /info signature plus model and MAC evidence."
      },
      "capabilities": {
        "baseline": [
          "camera",
          "controlPanel",
          "excludeObjects",
          "materials",
          "startPrint",
          "status",
          "upload"
        ],
        "supportedFileTypes": [
          "gcode"
        ],
        "conditional": [
          "multiMaterial is shown after physical CFS slots are reported",
          "auto-level is enabled only after a live structured status response"
        ]
      },
      "contracts": [
        "localFiles",
        "printPreparation",
        "dynamicPrintPreparation",
        "printHistory",
        "timelapses",
        "jobControl",
        "excludeObjects",
        "deviceControl",
        "filamentSlotControl"
      ],
      "ui": {
        "sections": [
          "status",
          "activeJobControls",
          "deviceControls",
          "camera",
          "localFiles",
          "filaments",
          "filamentEditor",
          "excludeObjects",
          "printHistory",
          "timelapses",
          "webControlPanel"
        ],
        "jobControls": [
          "pause",
          "resume",
          "cancel"
        ],
        "deviceControls": [
          "nozzleTemperature",
          "bedTemperature",
          "partFan",
          "light",
          "speed",
          "move",
          "home"
        ],
        "printOptions": {
          "filamentMappingMode": "transportManaged",
          "calibrationMode": "unsupported",
          "autoLevelingMode": "transportManaged",
          "supportsFlowCalibration": false,
          "supportsTimelapseCapture": false,
          "resolvedFromFirmware": true,
          "dynamicCandidates": [
            "calibration",
            "autoLeveling",
            "flowCalibration",
            "timelapseCapture"
          ]
        }
      }
    },
    {
      "order": 3,
      "id": "snapmaker_moonraker",
      "displayName": "Snapmaker (Moonraker)",
      "supportLevel": "verified",
      "sourceFile": "makersync_app/lib/services/transports/snapmaker_transport.dart",
      "connection": {
        "serviceTypes": [
          "_snapmaker._tcp.local"
        ],
        "defaultPorts": [
          7125,
          80
        ],
        "protocols": [
          "Moonraker HTTP",
          "Moonraker WebSocket"
        ],
        "authentication": "none",
        "probeSummary": "Snapmaker product_info.json on a Moonraker endpoint."
      },
      "capabilities": {
        "baseline": [
          "camera",
          "controlPanel",
          "excludeObjects",
          "materials",
          "multiMaterial",
          "startPrint",
          "status",
          "upload"
        ],
        "supportedFileTypes": [
          "gcode"
        ],
        "conditional": [
          "calibration options are discovered from firmware objects and G-code help"
        ]
      },
      "contracts": [
        "localFiles",
        "printPreparation",
        "dynamicPrintPreparation",
        "gcodePrintOptions",
        "printHistory",
        "timelapses",
        "jobControl",
        "excludeObjects",
        "deviceControl",
        "extruderControl",
        "filamentSlotControl"
      ],
      "ui": {
        "sections": [
          "status",
          "activeJobControls",
          "deviceControls",
          "camera",
          "localFiles",
          "filaments",
          "filamentEditor",
          "excludeObjects",
          "printHistory",
          "timelapses",
          "webControlPanel"
        ],
        "jobControls": [
          "pause",
          "resume",
          "cancel"
        ],
        "deviceControls": [
          "nozzleTemperature",
          "bedTemperature",
          "partFan",
          "speed",
          "move",
          "home"
        ],
        "printOptions": {
          "filamentMappingMode": "toolCommands",
          "calibrationMode": "unsupported",
          "autoLevelingMode": "unsupported",
          "supportsFlowCalibration": false,
          "supportsTimelapseCapture": false,
          "resolvedFromFirmware": true,
          "dynamicCandidates": [
            "calibration",
            "autoLeveling",
            "flowCalibration",
            "timelapseCapture"
          ]
        }
      }
    },
    {
      "order": 4,
      "id": "qidi_moonraker",
      "displayName": "Qidi (Moonraker)",
      "supportLevel": "verified",
      "sourceFile": "makersync_app/lib/services/transports/qidi_transport.dart",
      "connection": {
        "serviceTypes": [
          "_qidi-moonraker._tcp.local"
        ],
        "defaultPorts": [
          7125,
          10088
        ],
        "protocols": [
          "Moonraker HTTP",
          "Moonraker WebSocket"
        ],
        "authentication": "none",
        "probeSummary": "Qidi printer.cfg signature on Moonraker."
      },
      "capabilities": {
        "baseline": [
          "camera",
          "controlPanel",
          "excludeObjects",
          "startPrint",
          "status",
          "upload"
        ],
        "supportedFileTypes": [
          "gcode"
        ]
      },
      "contracts": [